{
  "$schema": "./schema.json",
  "roles": [
    {
      "title": "Software Engineer, Designer",
      "company": {
        "name": "Self Employed",
        "url": "https://darbymanning.com"
      },
      "start": "May 2025",
      "end": "Present",
      "bullets": [
        "Designing and developing websites and applications using Svelte and SvelteKit",
        "Developing bespoke plugins for Storyblok, for custom integrations"
      ]
    },
    {
      "title": "Software Engineer",
      "company": {
        "name": "Infinity Health",
        "url": "https://infinity.health"
      },
      "start": "Jul 2022",
      "end": "June 2025",
      "bullets": [
        "Led the end-to-end redesign of Infinity's web and native products",
        "Architected and shipped the React Native app with a scalable state and navigation strategy",
        "Owned the greenfield Svelte/SvelteKit rebuild of the web app, defining engineering standards and CI/CD"
      ]
    },
    {
      "title": "Software Engineer",
      "company": {
        "name": "Kyan",
        "url": "https://kyan.com"
      },
      "start": "Oct 2022",
      "end": "Jul 2022",
      "bullets": [
        "Working as the sole designer and Engineer on projects, responsible for the creative concepts and fully developed outputs of award winning projects"
      ]
    },
    {
      "title": "Software Engineer",
      "company": {
        "name": "Freelance"
      },
      "start": "Feb 2020",
      "end": "Oct 2022"
    },
    {
      "title": "Software Engineer",
      "company": {
        "name": "Kyan",
        "url": "https://kyan.com"
      },
      "start": "Dec 2017",
      "end": "Feb 2020"
    },
    {
      "title": "Software Engineer, Designer",
      "company": {
        "name": "KBA Marketing",
        "url": "https://kba.marketing"
      },
      "start": "Aug 2016",
      "end": "Dec 2017"
    },
    {
      "title": "CEO, Software Engineer, Designer",
      "company": {
        "name": "Creative Little Dots",
        "url": "https://creativelittledots.com"
      },
      "start": "Sep 2012",
      "end": "Aug 2016"
    },
    {
      "title": "Designer",
      "company": {
        "name": "Imprint Colour",
        "url": "https://imprintcolour.co.uk"
      },
      "start": "Jul 2006",
      "end": "Aug 2012"
    }
  ],
  "skills": [
    [
      "Svelte, SvelteKit",
      "JavaScript, TypeScript",
      "React, React Native, Next.js",
      "HTML, CSS, Sass, Tailwind",
      "Vitest, Jest, Playwright",
      "GraphQL, REST"
    ],
    [
      "Contentful",
      "Hygraph",
      "Storyblok",
      "Supabase"
    ]
  ],
  "projects": [
    {
      "name": "Infinity",
      "slug": "infinity",
      "logo": "/projects/infinity/logo.svg",
      "outputs": [
        "Web App",
        "Native App"
      ],
      "stack": [
        "React Native",
        "Expo",
        "Svelte",
        "SvelteKit",
        "Bun",
        "Bun test",
        "Playwright",
        "WebSockets",
        "Zod"
      ],
      "works": [
        "UI / UX",
        "Development"
      ],
      "url": "https://infinity.health",
      "credits": [
        {
          "name": "Nick Bolt",
          "role": "Software Engineer",
          "url": "https://linkedin.com/in/nicholas-bolt-850365267"
        },
        {
          "name": "Vinicius Horewicz",
          "role": "Head of Engineering",
          "url": "https://linkedin.com/in/viniciushorewicz"
        }
      ],
      "image": "/projects/infinity/image-1.png",
      "headline": "Led design and engineering across Infinity's web and native apps.",
      "headline_points": [
        "Owned SvelteKit web platform: real-time via WebSockets, OpenAPI client, functional error handling with neverthrow",
        "Architected React Native app: predictable state with Zustand, improved navigation, telemetry and testing",
        "Established engineering standards, CI/CD pipelines and a cross-platform design system",
        "Outcome: faster delivery cadence, higher reliability, better accessibility and UX"
      ],
      "content": "<h2>Product, design and engineering leadership</h2><p>Oversaw the end-to-end redesign of Infinity's web and native experiences, setting the product direction and establishing a pragmatic design system used across platforms. Focus on accessibility, performance and usability, with shared tokens and components to keep delivery fast and consistent.</p><h2>Native app architecture</h2><p>Architected and delivered the React Native app, restructuring navigation, data flows and local state for reliability and scale. Introduced a predictable state model (Zustand), improved error boundaries and telemetry, and raised code quality through testing and CI/CD.</p><h2>Web app platform</h2><p>Owned the greenfield rebuild of the web app with Svelte and SvelteKit. Implemented real-time updates with WebSockets, strong typing through OpenAPI-generated clients, and a functional error model with <a href=\"https://github.com/supermacro/neverthrow\" target=\"blank\" rel=\"noreferrer nofollow\">neverthrow</a>. Established engineering standards, modular architecture and automated releases to reduce lead time and increase reliability.</p>"
    },
    {
      "name": "Vector Suite",
      "slug": "vector-suite",
      "logo": "/projects/vector-suite/logo.svg",
      "outputs": [
        "Marketing Site",
        "Web App"
      ],
      "stack": [
        "Svelte",
        "SvelteKit",
        "Hygraph",
        "Zendesk"
      ],
      "works": [
        "UI / UX",
        "Development"
      ],
      "url": "https://vectorsuite.co.uk",
      "image": "/projects/vector-suite/image-1.png",
      "headline": "Led UI/UX and implementation for Vector Suite.",
      "headline_points": [
        "SvelteKit + Hygraph architecture with typed content models",
        "Fully bespoke front-end powered by a Zendesk integration for support and help centre",
        "Design system foundations for consistent marketing and app surfaces"
      ]
    },
    {
      "name": "The Lane",
      "slug": "the-lane",
      "logo": "/projects/the-lane/logo.svg",
      "outputs": [
        "Marketing Site"
      ],
      "stack": [
        "React",
        "Next.js",
        "Contentful",
        "React Testing Library"
      ],
      "works": [
        "Development"
      ],
      "agency": {
        "name": "Kyan",
        "url": "https://kyan.com"
      },
      "credits": [
        {
          "name": "Chris Myers",
          "role": "UI Design",
          "url": "https://twitter.com/LittleDotChris"
        },
        {
          "name": "Pete White",
          "role": "UI Design",
          "url": "https://petewhite.co.uk"
        },
        {
          "name": "David Quilter",
          "role": "Software Engineer",
          "url": "https://linkedin.com/in/david-quilter-95762a23"
        },
        {
          "name": "Tom Marshall",
          "role": "Solutions Architect",
          "url": "https://x.com/_tommarshall"
        }
      ],
      "url": "https://thelane.co.uk",
      "image": "/projects/the-lane/image-1.png",
      "headline": "Engineering for The Lane marketing site.",
      "headline_points": [
        "Performance-focused Next.js build with modern tooling",
        "Close collaboration with agency team and designers",
        "Automated testing and accessibility improvements"
      ]
    },
    {
      "name": "Mosaic Middle East",
      "slug": "mosaic-middle-east",
      "logo": "/projects/mosaic-middle-east/logo.svg",
      "outputs": [
        "Marketing Site"
      ],
      "stack": [
        "Svelte",
        "SvelteKit",
        "WordPress API",
        "Stripe"
      ],
      "works": [
        "UI / UX",
        "Development"
      ],
      "agency": {
        "name": "Creative Little Dots",
        "url": "https://creativelittledots.co.uk"
      },
      "credits": [
        {
          "name": "Matt Pilott",
          "role": "Software Engineer",
          "url": "https://x.com/Matt_Pilott"
        }
      ],
      "url": "https://mosaicmiddleeast.org",
      "image": "/projects/mosaic-middle-east/image-1.png",
      "headline": "End-to-end UI/UX and build for Mosaic Middle East.",
      "headline_points": [
        "SvelteKit front-end with WordPress API content pipeline",
        "Stripe integration for secure donations",
        "Accessible, performant marketing experience"
      ]
    }
  ],
  "links": [
    {
      "name": "GitHub",
      "url": "https://github.com/darbymanning",
      "icon": "/github.svg"
    },
    {
      "name": "Twitter",
      "url": "https://twitter.com/LittleDotDarby",
      "icon": "/x.svg"
    },
    {
      "name": "LinkedIn",
      "url": "https://linkedin.com/in/darbymanning",
      "icon": "/linkedin.svg"
    }
  ]
}
